{
  "$schema": "http://json-schema.org/draft-07/schema#",
  "additionalProperties": true,
  "properties": {
    "tool_module_relationships": {
      "items": {
        "additionalProperties": false,
        "properties": {
          "module_id": {
            "type": "string"
          },
          "module_label": {
            "minLength": 1,
            "type": "string"
          },
          "relationship": {
            "enum": [
              "uses_tool"
            ],
            "type": "string"
          },
          "source_refs": {
            "items": {
              "additionalProperties": false,
              "properties": {
                "page_end": {
                  "minimum": 1,
                  "type": "integer"
                },
                "page_start": {
                  "minimum": 1,
                  "type": "integer"
                },
                "rule_id": {
                  "type": "string"
                },
                "section_anchor": {
                  "minLength": 1,
                  "type": "string"
                },
                "section_id": {
                  "pattern": "^S-\\d+(?:-\\d+)*$",
                  "type": "string"
                },
                "section_stable_id": {
                  "type": "string"
                }
              },
              "required": [
                "rule_id",
                "section_id",
                "section_stable_id"
              ],
              "type": "object"
            },
            "minItems": 1,
            "type": "array"
          },
          "tool_id": {
            "pattern": "^[A-Za-z0-9\\-/.]+@v[0-9][A-Za-z0-9\\.-]*$",
            "type": "string"
          },
          "tool_label": {
            "minLength": 1,
            "type": "string"
          }
        },
        "required": [
          "tool_id",
          "tool_label",
          "module_id",
          "module_label",
          "relationship",
          "source_refs"
        ],
        "type": "object"
      },
      "type": "array"
    },
    "version_relationships": {
      "additionalProperties": false,
      "properties": {
        "current_version": {
          "type": "string"
        },
        "diff_hints": {
          "additionalProperties": false,
          "properties": {
            "next_pair_key": {
              "type": "string"
            },
            "previous_pair_key": {
              "type": "string"
            }
          },
          "type": "object"
        },
        "family_key": {
          "type": "string"
        },
        "lineage": {
          "items": {
            "type": "string"
          },
          "minItems": 1,
          "type": "array"
        },
        "next_version": {
          "type": [
            "string",
            "null"
          ]
        },
        "previous_version": {
          "type": [
            "string",
            "null"
          ]
        }
      },
      "required": [
        "family_key",
        "current_version",
        "previous_version",
        "next_version",
        "lineage",
        "diff_hints"
      ],
      "type": "object"
    }
  },
  "allOf": [
    {
      "else": {
        "$ref": "#/definitions/baseActive"
      },
      "if": {
        "properties": {
          "status": {
            "enum": [
              "superseded",
              "withdrawn"
            ]
          }
        },
        "required": [
          "status"
        ],
        "type": "object"
      },
      "then": {
        "$ref": "#/definitions/archivalAudit"
      },
      "type": "object"
    },
    {
      "if": {
        "properties": {
          "references": {
            "properties": {
              "tools": {
                "contains": {
                  "properties": {
                    "path": {
                      "pattern": "^tools/UNFCCC/",
                      "type": "string"
                    }
                  },
                  "required": [
                    "path"
                  ],
                  "type": "object"
                },
                "type": "array"
              }
            },
            "required": [
              "tools"
            ],
            "type": "object"
          }
        },
        "required": [
          "references"
        ],
        "type": "object"
      },
      "then": {
        "$ref": "#/definitions/unfcccStrict"
      },
      "type": "object"
    }
  ],
  "definitions": {
    "archivalAudit": {
      "properties": {
        "audit_hashes": {
          "properties": {
            "source_pdf_sha256": {
              "type": "string"
            }
          },
          "required": [
            "source_pdf_sha256"
          ],
          "type": "object"
        }
      },
      "required": [
        "audit_hashes"
      ],
      "type": "object"
    },
    "baseActive": {
      "properties": {
        "audit_hashes": {
          "properties": {
            "source_pdf_sha256": {
              "type": "string"
            }
          },
          "required": [
            "source_pdf_sha256"
          ],
          "type": "object"
        }
      },
      "required": [
        "audit_hashes"
      ],
      "type": "object"
    },
    "sourcePdfReference": {
      "additionalProperties": false,
      "properties": {
        "doc": {
          "type": "string"
        },
        "kind": {
          "type": "string"
        },
        "path": {
          "type": "string"
        },
        "sha256": {
          "type": "string"
        },
        "size": {
          "type": "integer"
        }
      },
      "required": [
        "doc",
        "kind",
        "path",
        "sha256",
        "size"
      ],
      "type": "object"
    },
    "toolReference": {
      "additionalProperties": false,
      "properties": {
        "doc": {
          "type": "string"
        },
        "kind": {
          "type": "string"
        },
        "path": {
          "type": "string"
        },
        "sha256": {
          "type": "string"
        },
        "size": {
          "type": "integer"
        },
        "url": {
          "type": [
            "string",
            "null"
          ]
        }
      },
      "required": [
        "doc",
        "kind",
        "path",
        "sha256",
        "size"
      ],
      "type": "object"
    },
    "unfcccStrict": {
      "allOf": [
        {
          "properties": {
            "audit_hashes": {
              "properties": {
                "rules_json_sha256": {
                  "type": "string"
                },
                "sections_json_sha256": {
                  "type": "string"
                },
                "source_pdf_sha256": {
                  "type": "string"
                }
              },
              "required": [
                "source_pdf_sha256",
                "sections_json_sha256",
                "rules_json_sha256"
              ],
              "type": "object"
            }
          },
          "required": [
            "audit_hashes"
          ],
          "type": "object"
        },
        {
          "properties": {
            "automation": {
              "properties": {
                "node_version": {
                  "type": "string"
                },
                "scripts_manifest_sha256": {
                  "type": "string"
                }
              },
              "required": [
                "scripts_manifest_sha256"
              ],
              "type": "object"
            }
          },
          "required": [
            "automation"
          ],
          "type": "object"
        },
        {
          "properties": {
            "provenance": {
              "properties": {
                "author": {
                  "type": "string"
                },
                "date": {
                  "type": "string"
                },
                "source_pdfs": {
                  "items": {
                    "$ref": "#/definitions/sourcePdfReference"
                  },
                  "minItems": 1,
                  "type": "array"
                }
              },
              "required": [
                "author",
                "date",
                "source_pdfs"
              ],
              "type": "object"
            }
          },
          "required": [
            "provenance"
          ],
          "type": "object"
        },
        {
          "properties": {
            "references": {
              "additionalProperties": false,
              "properties": {
                "tools": {
                  "items": {
                    "$ref": "#/definitions/toolReference"
                  },
                  "minItems": 1,
                  "type": "array"
                }
              },
              "required": [
                "tools"
              ],
              "type": "object"
            }
          },
          "required": [
            "references"
          ],
          "type": "object"
        },
        {
          "properties": {
            "audit": {
              "properties": {
                "created_at": {
                  "type": "string"
                },
                "created_by": {
                  "type": "string"
                }
              },
              "required": [
                "created_at",
                "created_by"
              ],
              "type": "object"
            }
          },
          "required": [
            "audit"
          ],
          "type": "object"
        }
      ],
      "type": "object"
    }
  },
  "properties": {
    "audit": {
      "type": "object"
    },
    "audit_hashes": {
      "type": "object"
    },
    "automation": {
      "type": "object"
    },
    "provenance": {
      "type": "object"
    },
    "references": {
      "type": "object"
    },
    "status": {
      "type": "string"
    }
  },
  "required": [
    "audit_hashes",
    "references"
  ],
  "type": "object"
}
