{
  "audit": {
    "created_at": "2025-12-20T23:13:16.413Z",
    "created_by": "ingest.sh"
  },
  "audit_hashes": {
    "rules_json_sha256": "59a588e7ade873e4a3231cb677bdedb6e43d179da7be9eddfb5986c22c2fad04",
    "sections_json_sha256": "115e0e99e2d45e3017d7e4464e4c9a8a7d10a0e7831cf6b0cfdcce20e87a5275",
    "source_pdf_sha256": "69d15565628ffd0d9084548f6b797ba65a0a743c0de70bcb8f940a682d681005"
  },
  "automation": {
    "scripts_manifest_sha256": "793dfb8e2e05c9d8b32edbc72b5560b2ff65530d8827dd192d07810091de4fac"
  },
  "provenance": {
    "author": "Fred Egbuedike",
    "date": "2025-12-20T23:13:16.413Z",
    "source_pdfs": [
      {
        "doc": "UNFCCC/AMS-III.BF@v02-0",
        "kind": "pdf",
        "path": "tools/UNFCCC/Agriculture/AMS-III.BF/v02-0/source.pdf",
        "sha256": "69d15565628ffd0d9084548f6b797ba65a0a743c0de70bcb8f940a682d681005",
        "size": 918647
      }
    ]
  },
  "references": {
    "tools": [
      {
        "doc": "UNFCCC/AMS-III.BF@v02.0#glos-CDM",
        "kind": "pdf",
        "path": "tools/UNFCCC/Agriculture/AMS-III.BF/v02-0/glos_CDM.pdf",
        "sha256": "62cbedc1d4fb3e66b9b37eb6ad2225eb998fad36aecdd20444095d7d46687e5c",
        "size": 277555,
        "url": null
      },
      {
        "doc": "UNFCCC/AMS-III.BF@v02-0",
        "kind": "pdf",
        "path": "tools/UNFCCC/Agriculture/AMS-III.BF/v02-0/source.pdf",
        "sha256": "69d15565628ffd0d9084548f6b797ba65a0a743c0de70bcb8f940a682d681005",
        "size": 918647,
        "url": null
      }
    ]
  }
}
